{
  "batchDir": "tests/fixtures/export-batch",
  "failures": [],
  "manifest": "manifest.json",
  "manifestSha256": "cccccccccccccccccccccccccccccccccccccccccccccccccccccccccccccccc",
  "ok": true,
  "schema": "edgp.export.batch.verification.v1",
  "summary": {
    "bytes": 1160,
    "exports": 2,
    "failures": 0
  }
}
